{
  "schema_version": "t025.style.application.v1",
  "job_id": "job-025-001",
  "profile_id": "profile-025-001",
  "profile_version": 2,
  "mapping_version": "style-map-1.0",
  "applied": true,
  "bounded_deltas": {
    "contrast_intent": 0.15,
    "skin_warmth_intent": 0.08
  },
  "safety_overrides": [
    "saturation_clamped"
  ]
}
